{
  "id": "yolen-yolen-d",
  "planet": "yolen",
  "text": ["Adonalsium's origin world.", "Every scholar's white whale."],
  "style": "khriss",
  "layout": {
    "left": "40%",
    "top": "74%",
    "rotation": "-0.9deg",
    "maxWidth": "140px"
  },
  "crossedOut": false,
  "correction": null,
  "sketch": null,
  "sketchSize": null
}
