{
  "id": "sel-sel-c",
  "planet": "sel",
  "text": ["Oyn is the only confirmed satellite,", "though earlier records mention", "a second body."],
  "style": "khriss",
  "layout": {
    "left": "30%",
    "top": "40%",
    "rotation": "1.6deg",
    "maxWidth": "140px"
  },
  "crossedOut": false,
  "correction": null,
  "sketch": null,
  "sketchSize": null
}
